{
  "$defs": {
    "node": {
      "additionalProperties": true,
      "allOf": [
        {
          "if": {
            "properties": {
              "type": {
                "const": "url"
              }
            },
            "required": [
              "type"
            ]
          },
          "then": {
            "required": [
              "url"
            ]
          }
        }
      ],
      "properties": {
        "custom-properties": {
          "additionalProperties": true,
          "type": "object"
        },
        "nodes": {
          "items": {
            "$ref": "#/$defs/node"
          },
          "type": "array"
        },
        "source": {
          "pattern": "^https://[^\\s]+$",
          "type": "string"
        },
        "title": {
          "minLength": 1,
          "type": "string",
          "pattern": ".*\\S.*"
        },
        "type": {
          "enum": [
            "folder",
            "url"
          ]
        },
        "url": {
          "pattern": "^https?://[^\\s]+$",
          "type": "string"
        },
        "icon": {
          "$ref": "#/$defs/icon"
        }
      },
      "required": [
        "type",
        "title"
      ],
      "type": "object"
    },
    "icon": {
      "type": "object",
      "required": [
        "src"
      ],
      "additionalProperties": true,
      "properties": {
        "src": {
          "type": "string",
          "pattern": "^(https://\\S+|data:image/(png|svg\\+xml|x-icon|webp|gif|jpeg)(;[^,\\s]*)?,\\S+)$"
        },
        "type": {
          "type": "string",
          "enum": [
            "image/png",
            "image/svg+xml",
            "image/x-icon",
            "image/webp",
            "image/gif",
            "image/jpeg"
          ]
        },
        "sizes": {
          "type": "string",
          "pattern": "^(any|(\\d+x\\d+)( \\d+x\\d+)*)$"
        }
      }
    }
  },
  "$id": "https://example.com/open-bookmarks.schema.json",
  "$schema": "https://json-schema.org/draft/2020-12/schema",
  "additionalProperties": true,
  "properties": {
    "custom-properties": {
      "additionalProperties": true,
      "type": "object"
    },
    "description": {
      "type": "string"
    },
    "format": {
      "const": "open-bookmarks/1.0"
    },
    "nodes": {
      "items": {
        "$ref": "#/$defs/node"
      },
      "type": "array"
    },
    "source": {
      "pattern": "^https://[^\\s]+$",
      "type": "string"
    },
    "title": {
      "minLength": 1,
      "type": "string",
      "pattern": ".*\\S.*"
    },
    "author": {
      "minLength": 1,
      "type": "string",
      "pattern": ".*\\S.*"
    },
    "updated": {
      "type": "string",
      "pattern": "^\\d{4}-(0[1-9]|1[0-2])-(0[1-9]|[12]\\d|3[01])(T([01]\\d|2[0-3]):[0-5]\\d(:[0-5]\\d)?(Z|[+-]([01]\\d|2[0-3]):[0-5]\\d)?)?$"
    },
    "version": {
      "minLength": 1,
      "type": "string",
      "pattern": ".*\\S.*"
    },
    "icon": {
      "$ref": "#/$defs/icon"
    }
  },
  "required": [
    "format",
    "title",
    "nodes"
  ],
  "title": "open-bookmarks pack",
  "type": "object"
}
