{"description":"How the standard icon field works: a pack icon, a folder icon, a URL icon, a data URI icon, and an SVG icon. Icon is optional everywhere, and type and sizes are optional inside it.","format":"open-bookmarks/1.0","icon":{"sizes":"32x32","src":"https://example.com/icons/pack.png","type":"image/png"},"nodes":[{"icon":{"sizes":"any","src":"https://example.com/icons/news.svg","type":"image/svg+xml"},"nodes":[{"icon":{"sizes":"16x16 32x32","src":"https://example.com/favicon.ico","type":"image/x-icon"},"title":"BBC News","type":"url","url":"https://www.bbc.com/news"},{"icon":{"src":"data:image/png;base64,iVBORw0KGgoAAAANSUhEUgAAAAEAAAABCAQAAAC1HAwCAAAAC0lEQVR42mP8Xw8AAwMCAO+ip1sAAAAASUVORK5CYII=","type":"image/png"},"title":"Example Site","type":"url","url":"https://example.com/"},{"icon":{"sizes":"any","src":"data:image/svg+xml,%3Csvg%20xmlns='http://www.w3.org/2000/svg'%20viewBox='0%200%2016%2016'%3E%3Ccircle%20cx='8'%20cy='8'%20r='8'%20fill='%231f6feb'/%3E%3C/svg%3E","type":"image/svg+xml"},"title":"Reuters","type":"url","url":"https://www.reuters.com/"}],"title":"News","type":"folder"}],"title":"Icons"}