{"custom-properties":{"example-client":"example-client-1","pack-icon":"star"},"description":"How custom-properties works: an icon, a UI accent, and a client version tag. The standard does not interpret any of these keys. They are for the client that reads the pack.","format":"open-bookmarks/1.0","nodes":[{"custom-properties":{"accent":"#1f6feb"},"nodes":[{"custom-properties":{"accent":"#1f6feb","client-version":"example-client-1","icon":"globe"},"title":"BBC News","type":"url","url":"https://www.bbc.com/news"},{"custom-properties":{"accent":"#333333","icon":"globe"},"title":"Reuters","type":"url","url":"https://www.reuters.com/"}],"title":"News","type":"folder"},{"custom-properties":{"accent":"#f5c518","client-version":"example-client-2","icon":"film"},"title":"IMDb","type":"url","url":"https://www.imdb.com/"}],"title":"Custom properties"}