{"description":"A pack that uses a remote folder. The remote URL in this example is an example only. Replace it with the URL of a real pack before importing, and only fetch it when you open the folder.","format":"open-bookmarks/1.0","nodes":[{"nodes":[{"title":"BBC News","type":"url","url":"https://www.bbc.com/news"}],"title":"Local links","type":"folder"},{"source":"https://example.com/remote-pack.json","title":"Remote links","type":"folder"}],"title":"Remote"}