{"description":"Folders nested four levels deep, to show how nesting works.","format":"open-bookmarks/1.0","nodes":[{"nodes":[{"nodes":[{"nodes":[{"nodes":[{"title":"Python","type":"url","url":"https://www.python.org/"}],"title":"Programming","type":"folder"},{"title":"Hacker News","type":"url","url":"https://news.ycombinator.com/"}],"title":"Technology","type":"folder"}],"title":"Topics","type":"folder"}],"title":"Collections","type":"folder"}],"title":"Nested"}